{
  "version": 1,
  "term": "2026/2027 - Term 1",
  "sessions": [
    {
      "id": "ai-applications-1-2-3-4-5-w1-sat-0900-lecture-f-seminar",
      "courseId": "ai-applications",
      "courseName": "Artificial Intelligence Applications",
      "type": "lecture",
      "week": "W1",
      "day": "sat",
      "start": "09:00",
      "end": "10:00",
      "instructor": "Dr. Mahmoud Samy",
      "room": "F-SEMINAR",
      "sections": [
        1,
        2,
        3,
        4,
        5
      ]
    },
    {
      "id": "ai-applications-1-2-3-4-5-w2-sat-0900-lecture-f-seminar",
      "courseId": "ai-applications",
      "courseName": "Artificial Intelligence Applications",
      "type": "lecture",
      "week": "W2",
      "day": "sat",
      "start": "09:00",
      "end": "10:00",
      "instructor": "Dr. Mahmoud Samy",
      "room": "F-SEMINAR",
      "sections": [
        1,
        2,
        3,
        4,
        5
      ]
    },
    {
      "id": "ds-fundamentals-13-w2-sat-0900-section-hall-a305",
      "courseId": "ds-fundamentals",
      "courseName": "Data Science Fundamentals",
      "type": "section",
      "week": "W2",
      "day": "sat",
      "start": "09:00",
      "end": "10:00",
      "instructor": "Eng. Ahmed Amin",
      "room": "HALL A305",
      "sections": [
        13
      ]
    },
    {
      "id": "ai-applications-13-w2-sat-1000-section-lab-d105",
      "courseId": "ai-applications",
      "courseName": "Artificial Intelligence Applications",
      "type": "section",
      "week": "W2",
      "day": "sat",
      "start": "10:00",
      "end": "11:00",
      "instructor": "Eng. Shahd Mohamed",
      "room": "LAB D105",
      "sections": [
        13
      ]
    },
    {
      "id": "expert-systems-15-w1-sat-1000-section-hall-d101",
      "courseId": "expert-systems",
      "courseName": "Expert Systems",
      "type": "section",
      "week": "W1",
      "day": "sat",
      "start": "10:00",
      "end": "11:00",
      "instructor": "Eng. Shahd Mohamed",
      "room": "HALL D101",
      "sections": [
        15
      ]
    },
    {
      "id": "expert-systems-6-w2-sat-1100-section-hall-d105",
      "courseId": "expert-systems",
      "courseName": "Expert Systems",
      "type": "section",
      "week": "W2",
      "day": "sat",
      "start": "11:00",
      "end": "12:00",
      "instructor": "Eng. Mohamed Amr",
      "room": "HALL D105",
      "sections": [
        6
      ]
    },
    {
      "id": "java-11-w1-sat-1100-section-plc-lab",
      "courseId": "java",
      "courseName": "Java",
      "type": "section",
      "week": "W1",
      "day": "sat",
      "start": "11:00",
      "end": "12:00",
      "instructor": "Eng. Mohamed Omar",
      "room": "PLC Lab",
      "sections": [
        11
      ]
    },
    {
      "id": "ai-applications-13-w1-sat-1100-section-lab-d103",
      "courseId": "ai-applications",
      "courseName": "Artificial Intelligence Applications",
      "type": "section",
      "week": "W1",
      "day": "sat",
      "start": "11:00",
      "end": "12:00",
      "instructor": "Eng. Shahd Mohamed",
      "room": "LAB D103",
      "sections": [
        13
      ]
    },
    {
      "id": "artificial-intelligence-13-w2-sat-1100-section-lab-a01",
      "courseId": "artificial-intelligence",
      "courseName": "Artificial Intelligence",
      "type": "section",
      "week": "W2",
      "day": "sat",
      "start": "11:00",
      "end": "12:00",
      "instructor": "Eng. Marwa",
      "room": "LAB A01",
      "sections": [
        13
      ]
    },
    {
      "id": "java-6-w1-sat-1200-section-g201",
      "courseId": "java",
      "courseName": "Java",
      "type": "section",
      "week": "W1",
      "day": "sat",
      "start": "12:00",
      "end": "13:00",
      "instructor": "Eng. Naglaa",
      "room": "G201",
      "sections": [
        6
      ]
    },
    {
      "id": "java-6-w2-sat-1200-section-d101",
      "courseId": "java",
      "courseName": "Java",
      "type": "section",
      "week": "W2",
      "day": "sat",
      "start": "12:00",
      "end": "13:00",
      "instructor": "Eng. Naglaa",
      "room": "D101",
      "sections": [
        6
      ]
    },
    {
      "id": "java-13-w2-sat-1200-section-lab-a01",
      "courseId": "java",
      "courseName": "Java",
      "type": "section",
      "week": "W2",
      "day": "sat",
      "start": "12:00",
      "end": "13:00",
      "instructor": "Eng. Mohamed Omar",
      "room": "LAB A01",
      "sections": [
        13
      ]
    },
    {
      "id": "expert-systems-14-w2-sat-1200-section-lab-d103",
      "courseId": "expert-systems",
      "courseName": "Expert Systems",
      "type": "section",
      "week": "W2",
      "day": "sat",
      "start": "12:00",
      "end": "13:00",
      "instructor": "Eng. Shahd Mohamed",
      "room": "LAB D103",
      "sections": [
        14
      ]
    },
    {
      "id": "ai-applications-15-w1-sat-1200-section-lab-d105",
      "courseId": "ai-applications",
      "courseName": "Artificial Intelligence Applications",
      "type": "section",
      "week": "W1",
      "day": "sat",
      "start": "12:00",
      "end": "13:00",
      "instructor": "Eng. Mohamed Ammar",
      "room": "LAB D105",
      "sections": [
        15
      ]
    },
    {
      "id": "expert-systems-6-w1-sat-1300-section-lab-d104",
      "courseId": "expert-systems",
      "courseName": "Expert Systems",
      "type": "section",
      "week": "W1",
      "day": "sat",
      "start": "13:00",
      "end": "14:00",
      "instructor": "Eng. Mohamed Amr",
      "room": "LAB D104",
      "sections": [
        6
      ]
    },
    {
      "id": "ds-fundamentals-9-w2-sat-1300-section-hall-g204",
      "courseId": "ds-fundamentals",
      "courseName": "Data Science Fundamentals",
      "type": "section",
      "week": "W2",
      "day": "sat",
      "start": "13:00",
      "end": "14:00",
      "instructor": "Eng. Mohamed Amr",
      "room": "HALL G204",
      "sections": [
        9
      ]
    },
    {
      "id": "ds-fundamentals-11-12-13-14-15-w1-sat-1300-lecture-g202",
      "courseId": "ds-fundamentals",
      "courseName": "Data Science Fundamentals",
      "type": "lecture",
      "week": "W1",
      "day": "sat",
      "start": "13:00",
      "end": "14:00",
      "instructor": "Dr. Sameh Mustafa",
      "room": "G202",
      "sections": [
        11,
        12,
        13,
        14,
        15
      ]
    },
    {
      "id": "ds-fundamentals-11-12-13-14-15-w2-sat-1300-lecture-g202",
      "courseId": "ds-fundamentals",
      "courseName": "Data Science Fundamentals",
      "type": "lecture",
      "week": "W2",
      "day": "sat",
      "start": "13:00",
      "end": "14:00",
      "instructor": "Dr. Sameh Mustafa",
      "room": "G202",
      "sections": [
        11,
        12,
        13,
        14,
        15
      ]
    },
    {
      "id": "ds-fundamentals-6-7-8-9-10-w1-sat-1400-lecture-a-new",
      "courseId": "ds-fundamentals",
      "courseName": "Data Science Fundamentals",
      "type": "lecture",
      "week": "W1",
      "day": "sat",
      "start": "14:00",
      "end": "15:00",
      "instructor": "Dr. Sameh Mustafa",
      "room": "A-New",
      "sections": [
        6,
        7,
        8,
        9,
        10
      ]
    },
    {
      "id": "ds-fundamentals-6-7-8-9-10-w2-sat-1400-lecture-a-new",
      "courseId": "ds-fundamentals",
      "courseName": "Data Science Fundamentals",
      "type": "lecture",
      "week": "W2",
      "day": "sat",
      "start": "14:00",
      "end": "15:00",
      "instructor": "Dr. Sameh Mustafa",
      "room": "A-New",
      "sections": [
        6,
        7,
        8,
        9,
        10
      ]
    },
    {
      "id": "java-14-w2-sat-1400-section-lab-a01",
      "courseId": "java",
      "courseName": "Java",
      "type": "section",
      "week": "W2",
      "day": "sat",
      "start": "14:00",
      "end": "15:00",
      "instructor": "Eng. Mohamed Omar",
      "room": "LAB A01",
      "sections": [
        14
      ]
    },
    {
      "id": "ds-fundamentals-1-2-3-4-5-w1-sat-1500-lecture-g204",
      "courseId": "ds-fundamentals",
      "courseName": "Data Science Fundamentals",
      "type": "lecture",
      "week": "W1",
      "day": "sat",
      "start": "15:00",
      "end": "16:00",
      "instructor": "Dr. Sameh Mustafa",
      "room": "G204",
      "sections": [
        1,
        2,
        3,
        4,
        5
      ]
    },
    {
      "id": "ds-fundamentals-1-2-3-4-5-w2-sat-1500-lecture-g204",
      "courseId": "ds-fundamentals",
      "courseName": "Data Science Fundamentals",
      "type": "lecture",
      "week": "W2",
      "day": "sat",
      "start": "15:00",
      "end": "16:00",
      "instructor": "Dr. Sameh Mustafa",
      "room": "G204",
      "sections": [
        1,
        2,
        3,
        4,
        5
      ]
    },
    {
      "id": "ds-fundamentals-6-w1-sat-1500-section-hall-g107",
      "courseId": "ds-fundamentals",
      "courseName": "Data Science Fundamentals",
      "type": "section",
      "week": "W1",
      "day": "sat",
      "start": "15:00",
      "end": "16:00",
      "instructor": "Eng. Dina",
      "room": "HALL G107",
      "sections": [
        6
      ]
    },
    {
      "id": "ds-fundamentals-6-w2-sat-1500-section-lab-a02",
      "courseId": "ds-fundamentals",
      "courseName": "Data Science Fundamentals",
      "type": "section",
      "week": "W2",
      "day": "sat",
      "start": "15:00",
      "end": "16:00",
      "instructor": "Eng. Dina",
      "room": "LAB A02",
      "sections": [
        6
      ]
    },
    {
      "id": "java-8-w1-sat-1500-section-lab-d102",
      "courseId": "java",
      "courseName": "Java",
      "type": "section",
      "week": "W1",
      "day": "sat",
      "start": "15:00",
      "end": "16:00",
      "instructor": "Eng. Naglaa",
      "room": "LAB D102",
      "sections": [
        8
      ]
    },
    {